,data,flag
672,"public static void main String args int choice String sid String new String String new String String new String String new String empty empty status System out println System out println System out print System out print System out println System out print System out print System out println System out print System out print System out println System out print System out print System out println Scanner sc new Scanner System in System out println System out println System out println login System out println System out println choice sc nextInt choice choice System exit choice from System out println Enter digit logging in sc next System out println Enter logging in from sc nextInt System out println Enter computer logging in sc nextInt choice from System out println Enter digit find sc next empty empty empty empty System out println User off choice from System out println Enter digit find sid sc next sid System out println User sid in in system break sid System out println User sid in in system break sid System out println User sid in in system break sid System out println User sid in in system break System out println None computer while choice 배열 아이디 로그 로그인 인 프로그램 [] { // ; ]; ]; ]; ]; ; ; ++) { ""; } ; ; ++) { ""; } { ; // # ; ; ++) { ""+ } (); ; ; ++) { ""+ } (); ; ; ++) { ""+ } (); ; ; ++) ""+ } (); == { } == { // :""); (); (); (); == { ]= ; } == { ]= ; } == { ]= ; } ]= ; } == { // :""); (); ; ; ++) { ]. ""; } ; ; ++) { ]. ""; } ; ; ++) { ]. ""; } ; ; ++) { ]. ""; } ""+ +"" .""); } == { // :""); (); ; ; ++) { ]. { ""+ +"" ; ; } ; ; ++) { ]. { ""+ +"" ; ; } } ; ; ++) { ]. { ""+ +"" ; ; } } ; ; ++) { ]. { ""+ +"" ; ; } } == { ; } } }",3
673,object 젝트 ,2
674,"Text Text split key key key list key key key in range list in Text split print list print list github 단어 추출 사이트 특정 체크 작업 감지 프로그램 함수 한글 탐색 은 리스트 띄어쓰기 학습 서 서플 플 "" # # "" "" # "" "" ;",5
675,"char string char String new String 배열 [] {' ', ' ', ' ', ' ', ' ', ' ', ' ', ' ', ' ', ' ', '",3
676,import util util ArrayList 완성 임 임포트 포트 성능 *,3
677,"db Input package example import android import android Context import android database Cursor import android database import android database import android database import android util Log public private static final String TAG database you run then change database private static final int private static final String NAME db table private static final String TABLE NAME table public static final String USER TABLE COLUMN id column id required cursor public static final String USER TABLE COLUMN NAME public static final String USER TABLE COLUMN tel public static final String private private database this that from database public Context new database public void String String are using sql format new String put USER TABLE COLUMN NAME put USER TABLE COLUMN put database TABLE NAME null public void delete String try database database delete TABLE NAME USER TABLE COLUMN NAME new String Log catch Exception Log public Cursor String SELECT FROM TABLE NAME USER TABLE COLUMN NAME Log TAG database null public void int id String String new String put USER TABLE COLUMN NAME put USER TABLE COLUMN put database TABLE NAME USER TABLE COLUMN id null public Cursor String throws Log TAG String query SELECT id as USER TABLE COLUMN USER TABLE COLUMN NAME USER TABLE COLUMN from TABLE NAME where Log TAG query Cursor database query null null this be database private extends public Context super NAME null Override public void onCreate your String TABLE TABLE NAME USER TABLE COLUMN INTEGER USER TABLE COLUMN NAME USER TABLE COLUMN Override public void int int schema code String TABLE TABLE NAME table onCreate create table from java package example import android Context import android database Cursor import android view LayoutInflater import android view View import android view import android widget import android widget TextView public extends public Context context Cursor super context Override public View Context context Cursor cursor parent when view be first time each item LayoutInflater inflater LayoutInflater from parent View inflater inflate layout list item parent false Override public void View view Context context Cursor cursor are setting that from cursor and put it in views TextView TextView view findViewById id tv setText cursor getString cursor cursor TextView TextView view findViewById id tv tel setText cursor getString cursor cursor MainActivity java package example import android app Activity import android app AlertDialog import android DialogInterface import android Intent import android database Cursor import android os Bundle import android os Handler import android util Log import android view LayoutInflater import android view import android view View import android widget import android widget import android widget EditText import android widget import android widget import android widget import android widget TextView import android widget Toast public MainActivity extends Activity implements private EditText private EditText public TextView public TextView private customAdapter private databaseHelper private static final int REQUEST private listView public String public String public String public String public private static final String TAG MainActivity Override public void onCreate Bundle savedInstanceState super onCreate savedInstanceState setContentView layout main findViewById id search User false this this databaseHelper new this TextView findViewById id tv TextView findViewById id tv tel listView findViewById id list listView new Override public void parent View view int long id Cursor cursor Cursor parent cursor cursor getString cursor databaseHelper USER TABLE COLUMN NAME cursor getString cursor databaseHelper USER TABLE COLUMN Toast makeText MainActivity this User Toast LENGTH SHORT Log TAG clicked on item id listView new Override public boolean parent final View view final int final long id Cursor cursor Cursor parent cursor getString cursor databaseHelper USER TABLE COLUMN NAME cursor getString cursor databaseHelper USER TABLE COLUMN final int item id cursor getInt cursor databaseHelper USER TABLE COLUMN new MainActivity this view inflate new Override public boolean item switch item case id LayoutInflater inflater LayoutInflater from MainActivity this View layout inflater inflate layout edit info null EditText layout findViewById id edit EditText layout findViewById id edit tel AlertDialog Builder new AlertDialog Builder MainActivity this setTitle layout new DialogInterface OnClickListener Override public void onClick DialogInterface dialog int String getText toString String getText toString databaseHelper item id databaseHelper customAdapter new MainActivity this databaseHelper listView customAdapter new DialogInterface OnClickListener Override public void onClick DialogInterface dialog int AlertDialog ad create ad break case id delete AlertDialog Builder new AlertDialog Builder MainActivity this false new DialogInterface OnClickListener Override public void onClick DialogInterface dialog int databaseHelper delete databaseHelper customAdapter new MainActivity this databaseHelper listView customAdapter new DialogInterface OnClickListener Override public void onClick DialogInterface dialog int AlertDialog alert create alert break false false new Handler post new Runnable Override public void run customAdapter new MainActivity this databaseHelper listView customAdapter public void View new Intent this REQUEST Override protected void int int Intent super REQUEST databaseHelper getString tag getString tag customAdapter databaseHelper Override public boolean false Override public boolean String query query false Override public boolean String false public void String query Cursor cursor databaseHelper query null query toString cursor null String from new String USER TABLE COLUMN NAME USER TABLE COLUMN int new int id tv id tv tel customAdapter new MainActivity this databaseHelper listView customAdapter 안드로이드 드로 이드 유저 // // "" // "" ""; // ""; // "" "" "" "" // // // +"" ""+ } "" * "" +"" ""+ +"" "" "" +"" ""+ // "" ""+ +"" ""+ +"" ""+ +"" // @ // "" "" "" "" "" "" "" "" ""+ @ // "" "" // // @ // // @ // // @ @ "" \ ""+ ""+ ). "" "" @ (). @ @ (). (). @ .\ ""+ ). ). @ @ (). @ ), @ == == (). (). @ @ @ // == } [] []",3
678,"String equals public static void main String throws IOException String String password String StringTokenizer new StringTokenizer int String new String int while String str str System out println System out println 클래스 소드 연산자 분리 배열 소스코드 "" "" "" "" [] // ==",3
679,"toString StringBuilder toString public String toString public String toString StringBuilder sb new StringBuilder sb append append append append append append append toString 소드 클래스 연결 연산자 사항 개의 필드 """,3
680,time struct time date time time struct time datetime time struct time datetime 체 ,5
681,"error define NO include stdio include stdlib include string int valid char char int int valid num char int int valid char int int char int main char pw printf Input password scanf pw strlen pw strlen pw printf password pw printf password printf password int valid char char int char aa sprintf aa int aa aa aa aa aa aa int valid num char int char aa sprintf aa int aa aa int valid char int char aa sprintf aa int aa int char int sum valid char strlen valid num strlen valid strlen sum error io password assert 판단 컴파일 언급 컴파일러 * * * * * == * ""% ; ; ++) * ""% ; ; ++) * ""% ; ; ++) == * == "" """,1
682,"include iostream include using namespace std int main ALL str str str wcout str endl wcout string size sizeof str endl wcout string str endl wcout endl wcout string str wcout str str str wcout string string str endl UTF 한글 인 인코딩 입 컴파일 [] "" << << << "" "" << << << "" "" << << << << "" >> << "" >> << "" "" << <<",2
683,"import turtle as int import random as int in range in range in range randint write print in range int print print print print 정답 리스트 "" =[ =[ )] ]= ): "" == "" "") "" "")",5
684,"PyQt PyQt GUI win error PyQt main app sys argv Dialog ui Dialog ui Dialog Dialog QtCore Dialog main Dialog hWnd None main hWnd int main win int main hWnd 외부 프로그램 개발 함수 해결방법 윈도우 제작 클래스 계산기 # ' ', ' __ __ == '__ # # "" # # ),",5
685,"csv output csv import csv open output csv encoding utf csv 특정 아이템 가격 프로그램 측정 (' ', ' ', =' ',",5
686,public void String split null try getText catch TODO Auto generated catch block printStackTrace split split 소스코드 '\ ' '\ \ | \ | ' (). (). } //,3
687, 그 단계 단순 랜덤 함수 수학 ,1
688, 한글 전부 ,3
689,"color cpp error src empty in function cv import cv as cv img color cv test cv img gray cv img color cv img binary cv img gray cv height width img binary shape open txt in range height in range width print img binary end write img binary print write cv img binary cv test img binary cv cv error modules src color cpp error src empty in function cv 작업 변화 ' :: ') (' ', # (' ', ' (""% ""% ], ="" (""% "" % (""\ (' ' :\ \ \ \ \ \ ' ::",5
690,public static int int array int Random new Random int int nextInt list int dat nextInt list list 배열 임의 삽입 랜덤 [] ; ; // // ;,3
691,socket AF INET connect recv 통신 서버 선언 ' ' ' ' ',5
692,are add non field address register can that database rows Please select models Register models Model models User on delete models company models CharField max office models CharField max address models CharField max tel models CharField max address forms CharField widget forms attrs dict required True max label tel forms CharField widget forms attrs dict required True max label Register models address tel  ' ' ; ',5
693,jQuery jQuery 선택 해제 ,4
694,  ,3
695,"xml encoding utf xmlns android http android android group android item android id id nav android drawable android android title item android id id nav tools android drawable android title item android id id nav android drawable android title item android id id nav android drawable android title item android id id nav android drawable android title group item android title null item android id id nav setting android drawable android title item android id id nav android drawable android title item item android title null http http th 안드로이드 드로 이드 드로이드 스튜디오 그림 추천 도구 프로그램 공간 ="" "" ="" ="" ="" =""@+ =""@ ="" ="" "" =""@+ =""@ ="" "" =""@+ =""@ ="" "" =""@+ =""@ ="" "" =""@+ =""@ ="" </ =""@ =""@+ =""@ ="" "" =""@+ =""@ ="" "" </ =""@ """,3
696,connect Error code google android search connect Error code Log 안드로이드 드로 이드 스튜디오 로그 소드 체 ,3
697,"url response GET url read html response comments html div html text comments comments encoding html text comments comments comments comments comments comments txt 오픈 싱 크롤링 리스트 각 별 ,' (""\ ,""",5
698,os path path open txt eof os path 크기 작업 함수 카운트 ',5
699,console app sys argv app exec app exec console command line thread thread console command line event GUI console line output 아무것 부족 경험 마 주신 학부 ,5
700,"boost system error code ec open ec option address ec bind port ec ec false bind bind TIME 서버 프로 옵션 실수 포트 :: :: :: :: :: ), ({ :: },",2
701,  ,3
702, 맨 함수 ,5
703,elif while len reverse  =( ....,5
704,"exit include iostream include stdlib using namespace std testclass private public private public testclass cout endl testclass cout endl void int exit int main testclass int cin main testclass main testclass exit main exit exit exit 함수 프로그램 소멸 소멸자가 자가 소멸자 자 단위 자로 이때 생성자 생성자가 컴파일 모든 <<"" ""<< <<"" ""<< >> "" "" "" "" "" "" ::",2
705,"script Error message error dev mall mall back node modules bcrypt code node pre gyp fallback build dev mall mall back node modules bcrypt node pre gyp info it it ok node pre gyp info using node pre gyp node pre gyp info using node win node pre gyp request node pre gyp download node pre gyp info check dev mall mall back node modules bcrypt lib binding bcrypt lib node node pre gyp http GET github node bcrypt js download bcrypt lib node win node pre gyp http github node bcrypt js download bcrypt lib node win node pre gyp download github node bcrypt js download bcrypt lib node win node pre gyp bcrypt and node node back source node gyp node pre gyp http status code github node bcrypt js download bcrypt lib node win dev mall mall back node modules bcrypt npm config node gyp node nodejs node modules npm bin node gyp bin node modules node gyp bin node gyp js node gyp info it it ok gyp info using node gyp gyp info using node win gyp info ok dev mall mall back node modules bcrypt npm config node gyp node nodejs node modules npm bin node gyp bin node modules node gyp bin node gyp js configure fallback build module dev mall mall back node modules bcrypt lib binding bcrypt lib node module bcrypt lib module path dev mall mall back node modules bcrypt lib binding napi node napi napi napi build node napi label node node configure fallback build module dev mall mall back node modules bcrypt lib binding bcrypt lib node module bcrypt lib module path dev mall mall back node modules bcrypt lib binding napi node napi napi napi build node napi label node gyp info it it ok gyp info using node gyp gyp info using node win gyp http GET nodejs org download release node gyp http nodejs org download release node gyp http GET nodejs org download release txt gyp http GET nodejs org download release win node lib gyp http GET nodejs org download release win node lib gyp http nodejs org download release txt gyp http nodejs org download release win node lib gyp http nodejs org download release win node lib gyp info spawn python exe gyp info spawn args Users AppData node modules npm node modules node gyp gyp gyp main py gyp info spawn args binding gyp gyp info spawn args gyp info spawn args gyp info spawn args gyp info spawn args auto gyp info spawn args gyp info spawn args dev mall mall back node modules bcrypt build config gyp info spawn args gyp info spawn args Users AppData node modules npm node modules node gyp gyp info spawn args gyp info spawn args Users node gyp include node gyp info spawn args gyp info spawn args gyp info spawn args dir Users node gyp gyp info spawn args gyp dir Users AppData node modules npm node modules node gyp gyp info spawn args lib Users node gyp target node lib gyp info spawn args dir dev mall mall back node modules bcrypt gyp info spawn args engine gyp info spawn args gyp info spawn args gyp info spawn args output gyp info spawn args dev mall mall back node modules bcrypt build gyp info spawn args dir gyp info ok dev mall mall back node modules bcrypt npm config node gyp node nodejs node modules npm bin node gyp bin node modules node gyp bin node gyp js build fallback build module dev mall mall back node modules bcrypt lib binding bcrypt lib node module bcrypt lib module path dev mall mall back node modules bcrypt lib binding napi node napi napi napi build node napi label node node build fallback build module dev mall mall back node modules bcrypt lib binding bcrypt lib node module bcrypt lib module path dev mall mall back node modules bcrypt lib binding napi node napi napi napi build node napi label node gyp info it it ok gyp info using node gyp gyp info using node win gyp info spawn exe gyp info spawn args build binding gyp info spawn args gyp info spawn args gyp info spawn args in this one at time build add switch dev mall mall back node modules bcrypt build bcrypt lib error that path in correct and that exists on gyp ERR build error gyp ERR stack Error exe exit code gyp ERR stack at Users AppData node modules npm node modules node gyp lib build js gyp ERR stack at js gyp ERR stack at emit js gyp ERR stack at Process handle child process js gyp ERR System gyp ERR command nodejs node exe nodejs node modules npm node modules node gyp bin node gyp js build fallback build module dev mall mall back node modules bcrypt lib binding bcrypt lib node module bcrypt lib module path dev mall mall back node modules bcrypt lib binding napi node napi napi napi build node napi label node gyp ERR dev mall mall back node modules bcrypt gyp ERR node gyp ERR node gyp gyp ERR ok node pre gyp ERR build error node pre gyp ERR stack Error execute node gyp build fallback build module dev mall mall back node modules bcrypt lib binding bcrypt lib node module bcrypt lib module path dev mall mall back node modules bcrypt lib binding napi node napi napi napi build node napi label node node pre gyp ERR stack at dev mall mall back node modules node pre gyp lib util js node pre gyp ERR stack at js node pre gyp ERR stack at emit js node pre gyp ERR stack at child process js node pre gyp ERR stack at Process handle child process js node pre gyp ERR System node pre gyp ERR command nodejs node exe dev mall mall back node modules node pre gyp bin node pre gyp fallback build node pre gyp ERR dev mall mall back node modules bcrypt node pre gyp ERR node node pre gyp ERR node pre gyp node pre gyp ERR ok execute node gyp build fallback build module dev mall mall back node modules bcrypt lib binding bcrypt lib node module bcrypt lib module path dev mall mall back node modules bcrypt lib binding napi node napi napi napi build node napi label node bcrypt nodejs and then add error message Please let can this problem it this problem  :\ \ \ \ \ -- :\ \ \ \ \ @ @ | | "" :\ \ \ \ \ \ \ \ "" ): @ @ :\ \ \ \ \ "" :\ \ \ \ \ \ \ \ \ "" @ @ | | :\ \ \ \ \ "" :\ \ \ \ \ \ \ \ \ "" -- -- :\ \ \ \ \ \ \ \ -- -- :\ \ \ \ \ \ \ -- -- -- -- -- -- :\ \ \ \ \ \ \ \ -- -- :\ \ \ \ \ \ \ -- -- -- -- @ @ | | :\ \ ' :\\ \\ \\ \\ \\ \\ \\ \\ \\ \\ \\ \\ ' ' ' ' :\\ \\ \\ \\ \\ \\ \\ ' :\\ \\ \\ \\ \\ \\ \\ \\ \\ \\ \\ ' :\\ \\ \\ \\ \\ \\ :\\ \\ \\ ', :\\ \\ \\ \\ \\ \\ \\ \\ \\ \\ :\\ \\ \\ :\\ \\ \\ \\ \\ ' :\\ \\ \\ \\ \\ \\ :\ \ \ \ \ "" :\ \ \ \ \ \ \ \ \ "" -- -- :\ \ \ \ \ \ \ \ -- -- :\ \ \ \ \ \ \ -- -- -- -- -- -- :\ \ \ \ \ \ \ \ -- -- :\ \ \ \ \ \ \ -- -- -- -- @ @ | | :\ \ \ \ \ ' ; ' ""/ "" :\ \ \ \ \ \ \ ): "" :\ "" :\ \ \ \ \ :\ \ \ \ \ \ \ \ \ \ \ \ ._ "" :\\ \\ \\ "" "" :\\ \\ \\ \\ \\ \\ \\ \\ "" "" "" "" :\\ \\ \\ \\ \\ \\ \\ \\ "" "" :\\ \\ \\ \\ \\ \\ \\ "" "" "" "" "" :\ \ \ \ \ ' -- -- :\ \ \ \ \ \ \ \ -- -- :\ \ \ \ \ \ \ -- -- -- -- ' :\ \ \ \ \ \ \ \ ._ "" :\\ \\ \\ "" "" :\\ \\ \\ \\ \\ \\ \\ "" "" "" :\ \ \ \ \ ' -- -- :\ \ \ \ \ \ \ \ -- -- :\ \ \ \ \ \ \ -- -- -- -- '",4
706, 자리 한글 읽기 ,3
707,key value 랜덤 단어 해석 ,3
708,"http request promise fs pipe error nodejs async await request pipe request promise const require request promise promise require fs require async function new promise async const fs html let options GET www undefined body undefined false json await options pipe on error err console log pipe err err async function try await async await console log write end async check catch err await promise error console log catch err console log err then console log request URL catch await options pipe on error err console log pipe err err catch err err promise pipe await options catch err err pipe on error err console log pipe err err request 다운로드 웹 해제 베이스 토 비 비동기 동기 모듈 연결 패키지 설치 (' (' (' => (' ' ' (' ', => (' (). => (' ', => => => (' ', =>",4
709,start end step start end step 리스트 라이 싱 특정 예상 원리 =[,5
710,cluster nginx cluster mode nginx http nginx error nginx cluster connection while node cluster github 모드 노드 앱 록 서버 포트 클라이언트 요청 랜덤 응답 현상 로그 연결 %,4
711,String String  ,3
712, 풀이 ,3
713,"def get print print None 매 기초 소 ' ': ' ': ' ': ' ': )* // (' ', (' ',",5
714,string int string char int false 스트링 ,2
715,while len pop 리스트 한데 소스코드 ,5
716,var bar first function value value function value bar value function next next 콜 콜백함수 함수 전역변수 // // //,4
717,"callback var function cb setTimeout function var sum var sum cb sum function result console log result console log first cb function result console log result first var function setTimeout function var sum var sum sum var function result console log result console log first 콜 콜백 질문안녕 함수 콜백함수 계산 인 자로 역할 자바 자바스크립트 스크립트 비 비동기 동기 ; ; }, // (' ; ; }, (' )** )** )** )**",4
718,"System out println public static String int Random ran new Random StringBuilder sb new StringBuilder while int ran nextInt break sb append char sb toString 랜덤 소스코드 "" "" "" "" "" "" == }",3
719,import io BufferedReader import io IOException import io InputStreamReader public public static void main String args throws IOException TODO Auto generated stub BufferedReader br new BufferedReader new InputStreamReader System in BufferedReader br new BufferedReader new InputStreamReader System in System in InputStreamReader BufferedReader br new BufferedReader new InputStreamReader System in Buffer System in 해 바이트 기반 스트림 연결 대입 연산자 버퍼 [] // & .),3
720,import util Scanner public public static void main String args int temp int new int Scanner scanner new Scanner System in System out println int System out print Input Number scanner nextInt int int temp temp break System out println System out println scanner System exit http 임의 [] [] ; ; ++) ; ; ++) ; ; ++) },3
