,data,flag
1361,"getchar include stdio float sum float float float dif float float float mul float float float div float float float sum float float float dif float float float mul float float float div float float int main void float printf scanf printf printf printf printf printf char op getchar switch op case printf sum break case printf dif break case printf mul break case printf div break char op getchar 실수 합 차 선택 합 * (""% % & & \ \ * \ \ (); // :% % % %",1
1362,tv 메 소드 강의 출력값 메소드 하면서 복사 ,3
1363,html net 반응 크기 ,4
1364,"hover var strong var strong hover var var hover var var hover area hover function this fill value strong this style fill strong hover this fill value this style fill hover this fill value this style fill hover function this fill value strong hover this style fill strong this fill value hover this style fill this fill value hover this style fill 변화 마우스 일정 "" =""# ""). == == == == == ==",4
1365,"requests from urllib request import urlopen from bs import BeautifulSoup import requests URL www login email password requests as first page get www login html first page text soup BeautifulSoup html html parser soup find print value value print post URL print 로그 사이트 작업 ' ' ': ' ' ': ' (' ' (' ', {' ': ' [' ': ['",5
1366,builder Builder  ,3
1367,"hong hong hong hong hong hong 질문문제 배열 알파벳 테이블 풀이 ', ' ', ' ', ' '], [' ', ' ', ' '], [' ', ' ', ' ', ' '], [' ', ' ', ' ', ' '], [' ', ' ', ' ', ' ', ' '] => => '",2
1368,"db slide slide slide slide html head int script src http code jquery jquery js script script document ready function pre click function attr src slide slide style px left px width height background white iframe width height id src slide slide No iframe id pre value target img disabled disabled img src img pre PNG width height id pre value target img img src img pre PNG width height id next value target img img src img next PNG width height body html 페이지 슬라이드 버튼 폴더 ="" ""></ ). ""). ""). ="" ; ; ; ; ; ="" "" ="" "" ="" "" ="" ="" "" ="" "" ="" (' == ="" "" =' ' ="" "" ="" ="" "" ="" "" ="" ="" "" =' ' ="" ="" "" ="" "" ="" ="" "" =' ' ="" ="" "" ="" "" =""",3
1369,char char char char 사이 입 [] [],3
1370,"include stdio char my strstr char str char str int main char str char str printf my strstr str str char my strstr char str char str char str str str str char str NULL include stdio char my strstr char str char str int main char str char str printf my strstr str str char my strstr char str char str char str str str str char str NULL str str char str str str str str char str str str 함수 분석 도중 서로 블록 다 널 주소값 결국 * * * [] "" [] "" (""% \ "" "" "" * * * * * * ; ++) ; * * * == * ; ++) { ; (* == { *) ; * * * [] "" [] "" (""% \ "" "" "" * * * * * * ; ++) ; * * * == * ; ++) (* == { *) ; ; * * * == * ; ++) { ; (* == { *) ; * ; ++) ; * * * == * ; ++) (* == { *) ; * * * *",1
1371,px 템플릿 브라우저 크기 갯수 %,5
1372,"import random import matplotlib pyplot as plt def def def def def get index random random sum in sum append item in sum item len def get index def draw in range append append main int Enter in draw plt plot plt title format plt  * * * * * * * * * * * * * =[ =[ =[ __ (' ,' (' { }",5
1373, 평균 파이어 베이스 데이터베이스 토 갯수 ,4
1374, 서버 구축 시스템 폰 연결 노 웹 립스 강의 로그 개발 스튜디오 ,3
1375,"api array fcstDate fcstDate fcstDate fcstTime null api fcstDate fcstTime json type public list String String String fcstDate String fcstDate String fcstTime String pop String pty String String sky String String fcstTime String pop String pty String String sky String String fcstTime String pop String pty String String sky String String fcstTime String pop String pty String String sky String public String public void String this public String public void String this public String fcstDate public void String fcstDate this fcstDate fcstDate public String fcstDate public void String fcstDate this fcstDate fcstDate public String fcstTime public void String fcstTime this fcstTime fcstTime public String pop public void String pop this pop pop public String pty public void String pty this pty pty public String public void String this public String sky public void String sky this sky sky public String public void String this public String fcstTime public void String fcstTime this fcstTime fcstTime public String pop public void String pop this pop pop public String pty public void String pty this pty pty public String public void String this public String sky public void String sky this sky sky public String public void String this public String fcstTime public void String fcstTime this fcstTime fcstTime public String pop public void String pop this pop pop public String pty public void String pty this pty pty public String public void String this public String sky public void String sky this sky sky public String public void String this public String fcstTime public void String fcstTime this fcstTime fcstTime public String pop public void String pop this pop pop public String pty public void String pty this pty pty public String public void String this public String sky public void String sky this sky sky public String public void String this java import java io BufferedReader import java io IOException import java io InputStreamReader import java net import java net URL import java text import java util import java util Date import java util import org json import org json JSONObject import org json parser import org json parser import import Request import public final static String public list list String String int int JSON String http kr service base date base time nx ny type json client new Request request new Request Builder url build response null try response client request execute catch Exception printStackTrace list dl new list try URL url new URL URL BufferedReader new BufferedReader new InputStreamReader url String line String result while line readLine null result result line System out println result JSON new JSONObject JSONObject parse result JSONObject parse response JSONObject get response JSONObject parse body JSONObject parse response get body JSONObject parse items JSONObject parse body get items int parse items size parse item parse items get item JSONObject String category String fcstDate String fcstTime dl dl int parse item size JSONObject parse item get category String get category fcstDate fcstTime fcstDate get fcstDate toString fcstTime get fcstTime toString Date date new Date System new date add new String format fcstDate equals dl dl fcstDate fcstDate switch fcstTime case dl fcstTime fcstTime switch category case dl pop get fcstValue toString break case dl pty get fcstValue toString break case dl get fcstValue toString break case dl sky get fcstValue toString break case dl get fcstValue toString break break case dl fcstTime fcstTime switch category case dl pop get fcstValue toString break case dl pty get fcstValue toString break case dl get fcstValue toString break case dl sky get fcstValue toString break case dl get fcstValue toString break break case dl fcstTime fcstTime switch category case dl pop get fcstValue toString break case dl pty get fcstValue toString break case dl get fcstValue toString break case dl sky get fcstValue toString break case dl get fcstValue toString break break fcstDate equals fcstTime equals dl fcstDate dl fcstTime switch category case dl pop get fcstValue toString break case dl pty get fcstValue toString break case dl get fcstValue toString break case dl sky get fcstValue toString break case dl get fcstValue toString break catch System out println catch IOException System out println IOException catch System out println dl fcstDate fcstTime 조회 오픈 요청 응답 아이템 오늘 날짜 파 파싱 싱 아이 특정 주석 무시 이하 완성 버퍼 배열 .) ..., "" "" ; "" % % // "" "" ="" ="" ="" ="" ="" ). } (); // // // { // // // ; (); ++) ; (); ++) // ""). ""). "" "" "" "" "" "" "" "" "" "" "" "" "" "" "" "" "" "" } "")) "" "" "" "" "" "" "" } "" } """,3
1376, 플레이어 원리 ,3
1377,"http www kr include include iostream using namespace std define LEFT define define define void bool void int dir char ns char void int int char ch int nStage int nx ny int int ex ey void int int char ch gotoxy ch const int char int main int ch int nStage ns nStage sizeof ns ns nx ny ns ns ex ey ns ch getch ch ch ch getch switch ch case LEFT case case case ch break ch ch ch break ch nStage nStage break ch nStage nStage break ch exit gotoxy cout nStage endl delay nStage nStage break void int ns nx ny ex ey gotoxy puts gotoxy puts gotoxy puts gotoxy printf nStage gotoxy printf bool int nStage ns false ns false void int dir int dx dy int bx by switch dir case LEFT dx bx break case dx bx break case dy by break case dy by break ns ny dy nx dx ns ny dy nx dx ns ny dy nx dx ns ny dy nx dx nStage ny dy nx dx ns ny dy nx dx ns ny dy nx dx ns ny dy nx dx ns ny dy nx bx gotoxy printf int while gotoxy printf char select cin select select select nx dx ny dy ns ey by ex bx ns ey by ex bx ns ey by ex bx gotoxy printf int while gotoxy printf char select cin select select select ex bx ey by 소 코 분석 플레이어 대로 ' ' @ # # @ # # # # @ # # # # # ], ; ; ++) ; ; ++) == ' } ; ; ++) ; ; ++) == ' ') ' == == == ' ') == ' ') == ' ') == ' ') << << "" "" << ; ; ++) ; ; ++) ' % % ; ; ++) ; ; ++) == ' ') == ' } == ' ') * * == ' ' * * == == ' * * ' == ' >> == ' ' == ' // == ' ') == >> == ' ' == '",2
1378,int enum public enum work int enum  ; // ',3
1379,mybatis List 노 테 리 소드 @,3
1380,const arr const arr arr function console log arr function console log console org docs Objects Array console log arr sorting 함수 콜 콜백함수 제공 배열 총 { { },4
1381,"int int age age rand age float int age float alpha age age alpha age age alpha age alpha alpha float float acc int float maxSpeed acc maxSpeed acc maxSpeed float float acc int float maxSpeed float maxSpeed acc acc maxSpeed acc acc maxSpeed struct car int age int goalT float velocity float accel float float float decel float alpha typedef struct car car float float float float alpha alpha car cars int main int age float maxvel float velMperSec int maxT int int minToSec int srand time NULL int int age age cars age age cars goalT cars accel cars decel cars alpha cars age int cars velocity cars printf Please first scanf cars accel printf Please velocity scanf maxvel printf Please time scanf cars printf Please scanf cars decel maxvel velMperSec maxvel minToSec cars maxT velMperSec cars accel velMperSec cars decel int minToSec maxT int maxT cars velocity cars velocity cars accel maxT maxT minToSec cars velocity velMperSec maxT minToSec cars velocity cars decel cars velocity cars velocity cars decel cars velocity cars cars cars velocity cars accel cars cars goalT cars goalT int int cars cars maxvel cars velocity cars accel cars velocity cars velocity cars alpha cars velocity cars accel cars velocity cars velocity cars cars cars velocity cars accel cars cars goalT cars goalT int record int record int cars goalT record cars goalT accel record 구조체 선언 단위 최대 랜덤 랜덤함수 함수 초기화 차 초기 속 거리 계산 도중 배열 % * * * * * * * *( ;// *( // ;// -> ;// ;// ;// -> ; ; ]. ]. ]. ]. ]. ]. ; ; ]. ]. (""% & ]. (""% & (""% & ]. (""% & ]. ;// * ;// * ]. ;// ]. ;// ]. ;// ; // ; ; ]. ]. ]. ]. ]. ]. ]. ]. ]. ]. ]. ]. ]. * ]. ;// ]. ]. == ]. ; ; ; ; ]. ]. ]. ]. ]. ], ]. ], ]. ]. ]. ]. ]. ]. ]. ]. * ]. ;// ]. ]. == ]. ; ; ; ; ]. ].",1
1382, 드로 이드 개발 도구 모바일 해석 컴파일러 배 애플리케이션 시스템 장점 성능 ,3
1383,public super public int one public int two public void one System out println super one sub extends super public int one public int two public int public void one System out println sub one public static void main String args super new sub super new sub System out println one one sub one sub one super one 클래스 형변환 오버 오버라이딩 라이 딩 메 메소드 소드 허용 [] (); // ();,3
1384,"void main printf printf No No false 소스코드 "" == """,1
1385,"Hello Hello include stdio include string int main char str while scanf str printf str 최대 알파벳 대문자 공백 라인 (""% \",1
1386,size back 조건문 # (); --; #,2
1387,"android String String new String NAME images Cursor images null rows all rows null none null Log query int NAME Log TAG getString int int id field values getString Log TAG date getString String id str getString id temp add toString Log temp temp values Log date date while 폴더 연결 동안 배열 클래스 리스트 리스트뷰 뷰 거기 리 고 요청 [] ._ // // // // "" ="" "" "" ._ // "" "" "" "" // "" ="" "" ="" }",3
1388,"execute html id github src github js const document getElementById github console log start let title execute var title document title title function console log console log end start end start end let title 웹 뷰 콜 콜백 할당 ="" "" ="" ""></ (' (' (' -> -> -> ->",4
1389,"xml xml bar type type bar import xml xml xml parse xml xml as string xml print xml as string xml bar type type bar 쓰기 ="" ="" </ ="" "" ="" ="" </ </",5
1390,printf scanf cout cin System out println System out print args int args scanf 입출력 명령어 작업 배열 (); (); (); (); [],3
1391,mvc parameter mvc parameter RequestMapping value GET public String index Map String Object model throws IOException RequestMapping value GET public String index request Map String Object model throws IOException request parameter request request 함수 엔 @ @ ();,3
1392,in range make make def init self in range make 메모리 메인 클래스 프로세스 리 공간 __ __(,5
1393,"tkinter button def init self window window title self button col in range in range self in range self in range self button self self Button window white command self self button self self grid self column self sticky def self self button self self configure red print self self 버튼 변화 함수 반응 __ __( [[ )] ]= ="" ]. ]. =""",5
1394,print print print 내의 프로그램 사항 ,5
1395,"Array public static void main String args char hex String binary String result int hex hex hex result binary hex end result binary hex end end System out println hex new String hex System out println binary result array System out println hex new String hex String new String char String 기초 사이 형변환 [] [] {' ', ' ', ' ', ' [] {"" "" "" "" "" "" "" "" "" "" "" "" "" "" "" "" ; ; ++) ' }// ' '+ }// }// ""+ ""+ ""+",3
1396,php html css javascript 학습 선택 웹 ,3
1397, 날짜 오늘 ,4
1398,"android xml android support widget android id id android layout width match parent android layout height wrap android layout width match parent android layout height wrap android support widget android id id android layout width match parent android layout height attr android background color android style app style app color white android support widget android id id style style android layout width match parent android layout height wrap android support widget app android id id android layout width match parent android layout height match parent android layout id android layout id View android id id android layout width match parent android layout height item select android layout id android background drawable bottom nav android support widget android id id android layout width match parent android layout height wrap android layout android id id android layout width wrap android layout height wrap app false android support widget filter 통신 버튼 메인 함수 성능 리 사이클 러 뷰 =""@+ ="" ="" ="" ="" =""@+ ="" =""@ =""@ =""@ =""@ </ =""@+ =""@ ="" ="" "" </ </ =""@+ ="" ="" =""@+ =""@+ "" =""@+ ="" =""@ =""@+ =""@ "" =""@+ ="" ="" ="" =""@+ ="" ="" ="" </ </",3
1399,db db php main html php main html 웹 동시 장 버튼 데이터베이스 베이스 메인 페이지 보기 -> ->,4
1400,"Node js Node js Request URL url port socket io sid sid url port url String sid sid const socket require socket io client let url url port let io socket connect url io on connect err console log io query path socket io sid sid io on error error console log err error io on message console log message io on message err Error xhr post error at dev js node modules engine io client lib js at Request dev js node modules engine io client lib xhr js at Request emit dev js node modules index js at Request dev js node modules engine io client lib xhr js at dev js node modules engine io client lib xhr js at js at js at js type ajax jquery 특정 홈페이지 크롬 개발자 도구 탭 프로그램 웹 괄호 -> =( =( & =( (' ' (' (' ' ': ' ': ' ': ' ': ' ' ': (' (' ', (' (' ') { :\ \ \ \ \ \ \ :\ \ \ \ \ \ \ \ :\ \ \ \ \ \ :\ \ \ \ \ \ \ \ ._ :\ \ \ \ \ \ \ \ ' ',",4
1401,"null DOCTYPE HTML HTML html head title title head body server received invalid response from server br body html catalina out 원인 개발 로컬 보기 ,"" // // >< </ >< </ ></",3
1402,openpyxl import random from openpyxl import from openpyxl import range from openpyxl utils import get column dest filename active title in range append random uniform in range append random uniform append append append append append del del del in range in range append random uniform in range append random uniform append append append del del del in range append random uniform in range append random uniform append append append list print in in range tmp str tmp pop save filename dest filename 엑셀 본문 기록 ' =' ]- )** ]- )** ]- )** ]- )** ]- )** ]- )** ]- )** ]- )** ]- )** ]- )** ]- )** ]- )** ]- )** ]- )** ]- )** ]- )** ]- )** ]- )** ]- )** ]- )** ]- )** ]- )** ' ]=,5
1403,"bootstrap html jsp script jQuery window load function use delay script jQuery window load function use var window height home item home video container css height window function use home item home video container css height 적용 부트 부트스트랩 스트랩 폴더 셀 니 자바 스크립트 ). $("". ""). ). ""). ). // $( ). $('# # '). (' ', $( ). $('# # '). (' ',",3
1404,date Date date new Date 클래스 고 ,3
1405,void String first String String String first 배열 소스코드 [] [] [],3
1406,key True create syntax TABLE id int NULL username utf unicode ci NULL password utf unicode ci NULL utf unicode ci NULL birthday utf unicode ci NULL on datetime NULL role id int NULL gender NULL active NULL id role id role id role id role id utf utf unicode ci 럼 유 속성 그림 필드 완성 적용 ',5
1407,"selenium block from selenium import webdriver from bs import BeautifulSoup import requests options webdriver options add argument options add argument disable options add argument Chrome options add argument lang driver webdriver Chrome chromedriver options options driver get www www Error code request by IP IP by 레니움 페이지 주석 우선 사이트 오픈 날짜 (' ') # (' ; ('/ ', \ ....",5
1408,public static void main String args System out println public static void main String args System out println 립스 소스코드 [] [],3
1409,public protected private public 클래스 인터페이스 상속 ,3
1410,"String InputStream String example InputStream  """,3
1411,node js node js 이벤트 ,4
1412, 날짜 ,4
1413,"printf printf print  (""% % % \ \ (""% \ \",1
1414,from math import def from import print 모듈 가정 ,5
1415,"String package import org springframework context support public public static void main String args throws Exception context new INF spring xml context context new INF xml at this line type org springframework beans be from required constructor String type xml xml encoding UTF beans xmlns http www springframework org schema beans xmlns http www org instance http www springframework org schema beans http www springframework org schema beans spring beans bean id constructor arg ref bean bean id bean beans  [] << ="" "" ="" ="" ="" ="" ="" "" ="" ="" "" </ ="" "" ="" </",3
1416,List element List element element List List List list list list elements in range 특정 함수 대입 항 합 리스트 임의 다 가정 입력값 ):,5
1417, 웹 사이트 개발 특정 헤더 페이지 갱신 버튼 그림 ,4
1418,STL vector STL 벡터 ,2
1419,"View template template board app app board index html models Model models User on delete models email models null True models CharField max birthday models def str self self username model from models import def birthday check request birthday list all render request board index html birthday list birthday list board view div birthday box birthday list ul new ul style padding px border bottom px black person in birthday list li new list style padding px person birthday li ul endif div admin birthday 모델 템플 템플릿 릿 템플릿 앱 오늘 자 회원 __ __( ' ', {' ': ="" {% ="" "" ="" ; {% ="" "" ="" </ {% </ {% {% </ {% %} ' '",5
1420,visual studio visual studio 상관 혼자 ,1
1421,Socket JSON http socket io 실시간 통신 웹 웹페이지 페이지 업데이트 ,4
1422,dict dict empty dict 리스트 튜플 ,5
1423, 패키지 설치 개발 프로그램 런 런타임 타임 개발자 컴파일 모든 걸 ,2
1424,"pandas import pandas as pd from pandas import DataFrame import numpy as np import matplotlib pyplot as plt import matplotlib from matplotlib import font manager font location font font manager font location get matplotlib rc font font matplotlib unicode False df pd read df df iloc df iloc df iloc df iloc df iloc df df iloc df iloc df iloc df iloc df iloc df df iloc df iloc df iloc df iloc df iloc df iloc df df iloc df iloc df iloc print df print df iloc df df df df merge 한글 로컬 추출 열 라이 싱 차 엑셀 ="" :\\ \\ \\ "" # ). # (' ', # [' '] ' :\\ \\ # # # #",5
1425,"json post url URL kr url import urllib import json import urllib import requests from BeautifulSoup import BeautifulSoup url kr response requests post url params print response text http import post html 홈페이지 싱 페이지 인 버튼 크롬 개발자 모드 파 파싱 소스코드 & "" ' ': [' ', ' ', ' ', ' ', ' ' ': [' ', ' ', ' ', '",5
1426,"list int int printf list print list 배열 (""% []",5
1427, 웹 애플리케이션 개발 북 ,4
1428,"private std cin private std cin private int char Name int public void void const void void void void const bool int id delete Name cpp void cout endl cout cin char cout cin Name new char strlen int money cout cin money money 멤버 멤버변수 불가능 문제점 헤더 헤더파일 전부 동적 당 모든 아이디 지점 :: :: ; * ; // // ; // (); // (); // ; // // [] :: << << << "" >> // * << "" >> ; // << "" >>",2
1429,"id ejs render page ejs textarea id value textarea value string code value ejs javascript 게시판 버튼 태그 공백 작업 서버 (' ', { ="" "" ="" "" '). (' ', $('# ').",4
1430,raw package example import app AppCompatActivity import android media import android os Bundle import android view View import android widget Button public MainActivity extends AppCompatActivity private int private int Button btn btn stop Override protected void onCreate Bundle savedInstanceState super onCreate savedInstanceState setContentView layout activity main new int raw raw raw btn setOnClickListener new View OnClickListener Override public void onClick View null stop create MainActivity this start null stop create MainActivity this start raw raw raw raw 안드로이드 드로 이드 스튜디오 플 @ @,3
1431,"include stdio include stdlib void main void char mes char mes char mes int temp FILE fp fopen txt FILE fp fopen txt long dw fp dw fp fseek fp END dw fp mes char malloc dw fseek fp mes dw fp dw mes mes mes char malloc dw temp mes mes mes mes memmove mes mes strlen mes mes temp free mes mes char malloc dw temp mes mes printf mes mes free mes free mes fclose fp fclose fp txt are 동적 당 고 * * * * "" * "" *) ; ; == ' ' == ' *) ' ' ' *) :% \",1
1432,json json Parent String type int Child extends Parent int height List Parent contents Child extends Parent int width Child Child Parent Parent String type Child List Parent contents contents json contents Child Child Child Parent type Child Child contents json type 상속 클래스 일반적 부모 자식 속성 내의 멤버 멤버변수 타입 부모클래스 체크 재귀 불가능 ,3
