,data,flag
1936,"web from bs import BeautifulSoup import operator import requests import re import bs def max book max chapter list book chapter while book max book while chapter max chapter url http www or kr php format book chapter source code requests get url text soup BeautifulSoup source code html parser text in soup font tk text get text replace split each in list append each chapter book chapter list list def list list list in list in range len replace len list append list def list in list in key value in items key operator print key value int you on chapter int type book int type chapter book max book int type last book max chapter int chapter book be last chapter elif int book max int last book chapter counter max elif int book you int chapter book you main st edit 프로그램 발견 단어 끝 거기 제외 장 장 ' & ). "" (' ', {' ': ' (). ' '). ], == == == __ __ == '__",5
1937,"int main void char printf char printf 초기화 소스코드 납 할려 "" ' ': "" (""% "" (""%",1
1938,"ArrayList array new new new ArrayList 배열 소스코드 초기화 [] { ), ),",3
1939,  ,3
1940,float sun http sun docs html html point point values point 연산자 페이지 == == == ==,3
1941,"xml Button android id id android layout height wrap android layout width fill parent android text android drawable android onClick android layout width fill parent Button LinearLayout findViewById id Button button new Button this button setText Button button setOnClickListener button new android view android view button 드로 드로이드 이드 버튼 동적 =""@+ ="" ="" ="" =""@ ="" =""",3
1942,"Write your function def delete lst lst temp lst print print lst lst print lst temp lst temp in lst print print print lst temp pop print break lst temp when your function done print delete print delete lst lst temp lst lst temp lst pop lst temp 리스트 대로 ,"" ,"" ,"" % == ,"" ,"" ([ ([",5
1943,"br var document getElementById seat onclick function function event onclick br br javascript scope and 이벤트 함수 끝 ; ; ++) ""+ ). // )`",4
1944,"json test test type email phone null null test type android email phone null test type android email phone null null import json open test json encoding UTF as json load email list in email keys json email TypeError list be or str 특정 추출 리스트 "" "" "" "" "" "" "" "" "" "" "" "" "" "" "" "" "" "" "" "" "" "" "" "" "" "" "" "" "" "" "" "" (' ', ' ', =' ') [' '].",5
1945,"jquery html node js pre html pre jquery 페이지 로드 문구 임시 사용법 추천 ="" </",4
1946,"new int cout new int endl empty 메모리 할당 개인적 이건 모든 컴파일러 적용 표준 "" << <<",2
1947,socket io node js express socket io localhost localhost db 채팅 개발 웹 접속 방 팝업 탭 로그 로그인 인 페이지 고침 유지 ,4
1948, 진수 은 인건 ,2
1949,"br br br br br br br br br br br br include iostream using namespace std Complex private int real int imag public constructor Complex int int real imag Complex const Complex copy real copy real imag copy imag int const real int const imag global friend Complex operator int value Complex num binary operator Complex operator const Complex num const Complex operator const int value const operator Complex operator const Complex num Complex operator const int value Complex operator Complex operator int Complex operator Complex operator int global Complex operator int value Complex num num value binary operator Complex Complex operator const Complex num const int this real num this imag num int this real num this imag num Complex Complex Complex operator const int value const int this real value int this imag value Complex operator Complex Complex operator const Complex num this real num this imag num this Complex Complex operator const int value this real value this imag this Complex Complex operator real this Complex Complex operator int Complex temp this real temp Complex Complex operator real this Complex Complex operator int Complex temp this real temp main int main Complex Case Case Case Case Error Main Case br Case Error br br Case br http 오버 딩 연산자 컴파일 클래스 프로그램 전역 함수 케이스 스택 소스코드 은 ></ )** </ ></ ></ ></ </ // ), & ), // { ; { ; // *( & // *( & *( // & =( & & =( // & & *( & * :: *( & -> )* -> )* -> )* -> )* :: *( -> )* -> )* & :: =( & -> -> * & :: =( -> -> * & :: * :: (* & :: * :: (* * ; // * // ++) * ; // * // => </ ></ (_",2
1950,"options args env long status options path Open args args args options options status void env args cls status ERR cls env Open cls env cls lang String lang String args env path args args env search term env cls args args args Open String path int index String term Open java lang String Open Open src 메 메소드 소드 클래스 한데 * * :\\ \\ \\ & (& & -> // { -> "" ; -> (""""); // ; // -> (""""); // -> (_ -> "") "") :\ \ \ \ \",2
1951,java test ref new ref test test 참조 실 부모 자식 오버 오버라이딩 라이 딩 공부중 클래스 함수 자바 ;,2
1952,Cannot make static reference non static string public static final String String getText string Cannot make static reference non static 프로그램 삽입 ,3
1953,Class Test new new new new 메모리 타입 연산자 연속 할당 영역 (); ();,3
1954,"os path def dir str raw you os path str True print print or your system str raw dir os path str 검사 디렉토리 프로그램 명령어 == ' """,5
1955,import as print 계산 모듈 함수 명령어 루트 ^ (' =( ).,5
1956,xml 폼 복사 모델 ,3
1957,"node js ajax click function ajax type post url success function result status xhr html result error function xhr status preventDefault ejs render layout false jquery ejs script src main js script 비 비동기 동기 페이지 버튼 클릭 이벤트 인식 이제 '). "" ""/ ""). (' ' { =""/ ""></",4
1958,"def len num in range num or or def or elif or elif or elif or elif or elif or 진수 프로그램 알파벳 보기 칸 ' ' ' ' ' * ' ' ' ' ' ' ' ' ' "" ' '",5
1959,"import javax swing import java awt import java awt event import java util public Main extends JFrame private JTextField tf new JTextField private JTextField new JTextField public String new String public String new String public String new String public String new String public Main setTitle JFrame EXIT ON setLayout null JLabel new JLabel Enter setSize add JLabel eng new JLabel eng setSize eng add eng tf setSize tf add tf JButton new JButton setSize add JLabel new JLabel setSize add setSize add JButton new JButton setSize add JLabel new JLabel setSize add list list setSize add new add JLabel new JLabel setSize add list list setSize add JLabel copy new JLabel copy setSize copy copy Color add copy Enter tf addActionListener new ActionListener public void actionPerformed ActionEvent JTextField JTextField add getText setText addActionListener new ActionListener public void actionPerformed ActionEvent String ss tf getText String add ss tf setText Enter addActionListener new ActionListener public void actionPerformed ActionEvent JTextField JTextField add getText setText addActionListener new ActionListener public void actionPerformed ActionEvent String ss getText String add ss setText setSize setVisible false private void new new add new add addActionListener new implements ActionListener public void actionPerformed ActionEvent new public static void main String args TODO Auto generated stub new Main import javax swing import java awt import java awt event import java util math import java Main public extends JFrame public setTitle JFrame EXIT ON setLayout null setSize setVisible false JLabel test new JLabel test setSize test add test JLabel new JLabel setSize add String window new String window setSize window add window get 클래스 멤버 개발자 패키지 내의 선언 단어 랜덤 목적 스크롤 한글 리스트 프레임 프레임 윈도우 프로그램 배 함수 크기 버튼 클릭 라벨 필드 사이즈 입력시 이벤트 리스 벡터 아이템 함 // // >(); // // >(); // // // // (); // // (); // // // // // // // // // // // // // // // // // // // // // // // // // // // // // // // // // // // // // // // // // // // // // // // // // // (); // ()); // (""""); // // // { (); // // (""""); // // // (); // ()); // (""""); // // // { (); // // (""""); // // // // // { // (); // // // ()); // // { // (); // [] // { // // (); // // // // // //",3
1960,self label QLabel background color white color blue self label QLabel background color white color blue self label QLabel background color white color blue self label QLabel background color white color blue in range self label QLabel background color white color blue 복문 장 수명 { ; ; { ; ; { ; ; { ; ; { ; ;,5
1961, 비 함수 포인터 ,1
1962,  ,1
1963,txt txt txt txt 폴더 하위 디렉토리 특정 단어 ,3
1964,exe Users AppData Local Local 인 모듈 설치 유 이하 폴더 플 플리케이션 리 케이 션 :\ \ \,4
1965,"BeautifulSoup import requests bs requests get http status soup bs BeautifulSoup text html parser soup select title elem in print output py title title title title replace title list object has attribute replace 프로그램 프린트 태그 (' "" (' $ </ </ ' ' '",5
1966,hover hover hover hover 적용 효과 특정 ,4
1967,color hex String android Color 안드로이드 드로 이드 # #,3
1968,"import openpyxl int openpyxl active cell column value in range result in range cell column value result get print result save result 엑셀 나열 증가 * ). ="" }) ). ('",5
1969,"in range NUM STRING str string in range NUM STRING print 딕 너리 왼쪽 { __ ', ' ', ' ', ' ', ' ', ' ', ' ', ' ', ' ', ' ', ' ', ' ', ' ', ' ', ' ', ' ', ' ', ' ', ' ', ' ', ' ', ' ', ' ', ' ', ' ', ' ', ' ', ' ', ' ', ' ', ' ', ' ', ' ', ' ', ' ', ' ', ' ', ' ', ' ', ' ', ' ', ' ', ' ', ' ', ' ', ' ', ' ', ' ', ' ', ' ', ' ', ' ', ' ', ' ', ' ', ' ', ' ', ' ', ' ', ' ', ' ', ' ', ' ', ' ', ' ', ' ', ' ', ' ', ' ', ' ', ' ', ' ', ' ', ' ', ' ', ' ', ' ', ' ', ' ', ' ', ' ', ' ', ' ', ' ', ' ', ' ', ' ', ' ', ' ', ' ', ' ', ' ', ' ', ' ', ' ', ' ', ' ', ' ', ' ', ' ', ' ', ' ', ' ', ' ', ' ', ' ', ' ', ' ', ' ', ' ', ' ', ' ', ' ', ' ', ' ', ' ', ' ', ' ', ' ', ' ', ' ', ' ', ' ', ' ', ' ', ' ', ' ', ' ', ' ', ' ', ' ', ' ', ' ', ' ', ' ', ' ', ' ', ' ', ' ', ' ', ' ', ' ', ' ', ' ', ' ', ' ', ' ', ' ', ' ', ' ', ' ', ' ', ' ', ' ', ' ', ' ', ' ', ' ', ' ', ' ', ' ', ' ', ' ', ' ', ' ', '",5
1970,multiprocessing Test write read self win import time from multiprocessing import Process Test def init self self queue self end def write self in range self queue append break end self end def read self while True self queue time sleep ans self queue pop print ans end self queue and self end break main Test Process target write args write start Process target read args read start join join 속 함수 멀티 모듈 동시 큐 완료 프로세스 __ __( # # == # # # == __ __ == '__ # # #,5
1971,ArrayList String null ArrayList String null null 배열 { },3
1972,html 개발 기초 툴 발견 ,3
1973, 이메일 메 메소드 소드 ,3
1974,"one more select one more select or select result True result False print result True True False 이요 함수 출력값 "" "" "" "" "" "" "" """,5
1975,"index html app js localhost localhost app js fetch http localhost test json then function response console log response fetch at http localhost test json from http has been by No header on resource response your request mode fetch resource disabled fetch http localhost test json mode then function response console log response type url false status ok false body false ok false false status type url fetch 하면서 로컬 요청 모드 (' ', ' ' ' ' ' ' ' ' ' (' ', ' { "" """,4
1976,"PC github localhost PC PC db mysql NAME server USER PC IP PC PC PC localhost admin at admin connect server on localhost PC localhost login PC create by all on my bind address PC mysql PC IP commit admin admin PC setting admin PC 외부 연결 서버 구동 서비스 접속 오른쪽 클릭 표 계정 포트 인 아웃 포트 허용 테이블 작업 모델 설치 데이터베이스 임 ' ': ' ': ' ': ' ', ' ': ' ', ' ': ' ', ' ': ' ', ' ': "" ' ' ' ' ' ' "" '",5
1977, 테 릿 북 ,3
1978,"Socket io Socket io socket io client socket socket id io socket id emit event message socket socket id socket id table field socket id session cookie 채팅 앱 애플리케이션 서버 개발 계정 로그 로그인 인 유저 접속 클라이언트 한 서 동기화 유지 예상 대부분 (' ', )`",4
1979, 개발자 프로그램 개발 컨트롤러 클래스 함수 로직 직 함 수명 초보자 ,3
1980,"import random def num in in num append random while True inp str inp print continue exe Users test Traceback most recent call last File Users test line in module inp str File string line in module Process exit code 웹 인터 [' ', ' ', ' ', ' ', ' ', ' ', ' ', ' ', ' ', ' ', ' ', ' ', ' [' ', ' ', ' ', ' == ' :/ "" :/ ""< ' '",5
1981,"open keyword txt encoding utf output open output txt encoding utf output while True chunk read chunk break chunk chunk replace chunk chunk replace chunk chunk replace chunk chunk replace chunk chunk replace chunk chunk replace chunk chunk replace chunk chunk replace chunk chunk replace chunk chunk replace chunk chunk replace chunk chunk replace output write chunk 한글 자리 표 은 "" ="" "" ="" (""\ "" "" "" "" "" "" "" "" "" "" """,5
1982,StringTokenizer String char  [],3
1983,"linked list bool Delete int void listClass cout list endl temp Head temp Head temp temp int temp temp int temp temp temp Data temp Data Delete typedef struct int Data struct node typedef node listClass public listClass listClass const listClass listClass void int int Item void Delete int void int int void bool int void void void reverse private int Head reverse 단순 리스트 여부 함수 길이 체크 정수 수가 클래스 연결 :: << "" "" << -> ; ; -> ; ; -> -> == -> * * & *",2
1984,document write 특정 입력값 가정 // << (',4
1985,"import sys print sys sys write from import print function print sys 소스코드 >> ' (' \ __ __ (' ',",5
1986,"pandas column food pandas column list frame string 특정 리스트 가정 개의 목표 엑셀 ',' ',' ,' [' ',' ',' [' ,' [' ' ',' ',' ' ,' ' ' '",5
1987,"warning char char warning change array include stdio include stdlib void change array char char temp malloc sizeof char int temp temp int main int char scanf change array printf array changed printf printf 배열 행렬 함수 경고 참조 ' ': ' ' ' ': * )* ; ; ++) *( *( ; ; ++) ; ; ++) (""% & \ ; ; ++) ; ; ++) (""% (""\",1
1988,int String  ,3
1989,"int main int int malloc sizeof int printf printf 배열 코 컴파일 소스코드 == * *) )* (""% \ (""% \",1
1990,Flask Flask py from flask import def get self def get self id id post delete put def post self id main py import app Flask api app api add resource board main app run http localhost def get self http localhost id def get self id http localhost board parameter id def get self def get self id get get 함수 파라미터 무시 작성중 최근 조회 생략 메 메소드 소드 자 특정 페이지 클래스 # {' # # __ __ == '__ ): } ): ):,5
1991,"include stdio include string define SIZE define INT MAX int line int int int temp temp int SIZE char city SIZE SIZE int num num int start end char start char end char int weight int graph SIZE SIZE int time int path SIZE SIZE int path SIZE INT MAX int visit SIZE int visit SIZE int BFS SIZE int dist SIZE int queue SIZE void BFS int int int front rear int visit queue rear BFS while front rear queue front front graph BFS visit queue rear rear BFS void int int int dist start num INT MAX num visit dist dist visit num dist dist graph dist dist graph int main FILE FILE city fopen txt city fopen city txt fscanf num num num num fscanf city city num printf city num dist INT MAX num num graph INT MAX num fscanf line line fscanf temp temp weight graph temp temp weight graph temp temp weight printf scanf start char printf scanf end char num strcmp city start char start printf start num strcmp city end char end printf end BFS start num num start num visit end dist end INT MAX printf dist end printf num path end printf path end printf time dist end printf time printf exit printf none txt city txt 정점 목적 끝 임 임시 예상 최 최단 거리 선택 최단 계산 함수 배열 상관 소스코드 ; // ]; // ; // ], ; // { ; // { }; // { { { { ; ; ++) == ; ; ; ; // ; ; ++) { ; ; ; ++) { == // { ]; ; } } ; // ; ; ++) { // ]; } } * * "" "" ""% & ; ; ""% & ; ; (""% % \ ], ; ; ; ; ; ; ; ; ""% & ; ; ""% % % & & & (""% (""% ; ; ], == (""% \ ; ; ], == (""% \ ; == ; == % \ (""\ ; ; (""% (""\ % (""\ \",1
1992,div background url div img 그 클릭 기본적인 웹 웹사이트 사이트 원본 사이즈 크기 태그 ,4
1993,import import 모듈 서버 업데이트 ,5
1994, 중인 회 이제 자료구조 함 동시 수학 ,3
1995,"keys age food values dict age food keys age food values dict dict keys values 튜플 소스코드 (' ', ' ', ' (' ', ' {' ' ' ', ' ' ' ' ' (' ', ' ', ' (' ', ' ({",5
1996,max max package import util public first public static void main String args Scanner new Scanner System in System out print int max nextInt int int int max System out print 최대값 제한 합 최대 입력하세 # { [] { ; ;,3
1997,IP 웹 서버 채팅 노트북 립스 프로그램 구축 계정 불가능 선 ,3
1998,"stack postfix package import util ArrayList import util Scanner import util StringTokenizer GStack static int Object stck public GStack stck new Object public null stck public void push item stck item public pop null stck public private static int String temp equals temp equals temp equals temp equals temp equals temp equals temp equals temp private static int String temp equals temp equals temp equals temp equals temp equals temp equals temp equals temp equals temp equals temp static String StringTokenizer st GStack String stringStack new GStack String int st ArrayList String new ArrayList String int String token st try Double token add token System out print token catch switch token case while equals stringStack add stringStack System out print stringStack pop stringStack pop break case case case case case stringStack token while stringStack add stringStack System out print stringStack pop stringStack push token break case while stringStack add stringStack System out print stringStack pop String String join static double String GStack Double DoubleStack new GStack Double StringTokenizer st new StringTokenizer int st double temp double op op int String token st token equals false token equals false token equals false token equals false try temp Double token DoubleStack push temp catch op DoubleStack pop op DoubleStack pop switch token case DoubleStack push op op break case DoubleStack push op op break case DoubleStack push op op break case DoubleStack push op op break temp public static void main String args Scanner in new Scanner System in System out print String in nextLine StringTokenizer st new StringTokenizer String st double result System out print result in 계산기 수식 [] == == == ""). ; ; ++) "" } "" "" "" "" ; ; ++) == == == == } } * [] ""+ *( """,3
1999,"static void loop loop loop loop loop loop and json where error github js 출처 * [] '] [' '] '] '] // [] {} // // // * ; // ' [[ """,1
2000,sql apache tomcat tomcat sql database 웹 플 플리케이션 리 케이 션 개발 서버 관계 ,3
2001, 채팅 도중 ,3
2002,"std string str int conv std str int range try catch try std string str int conv std str catch const std string std cout range try try catch 함수 :: "" :: :: "" :: :: & :: << << ' \ '",2
2003, 별 프로그램 ,1
2004, 포인터 ->,2
2005, 안드로이드 드로 이드 보기 드로이드 ,3
2006,import os from subprocess import check output print check output dir True utf subprocess print dir utf codec can byte in invalid start byte byte utf 모듈 명령어 프로그램 한글 명령 ). (' ' ',5
2007,"include stdio define MAX typedef struct int degree float coef MAX polynomial polynomial product polynomial polynomial int polynomial int degree degree int degree degree degree degree degree MAX coef degree degree coef coef coef void main void polynomial polynomial polynomial product int printf degree degree printf lf coef printf lf coef 차 상수 # ; ; ; ; ; ; { { } { { } % \ ; ; (""% \ \ ]);",1
2008,list list list list list list list append 리스트 복사 대입 소스코드 ,5
2009,"int int boolean result false result System out println result 연산자 """,3
2010,"pragma include iostream Base public struct StructTest Base Base int StructTest private StructTest Test include Base struct Base StructTest StructTest int int Base StructTest StructTest Base Base Test NULL std cout Base std endl Test new StructTest Base Base std cout Base std endl int Base Test Base StructTest Base Test pragma include Base Child public Base public Child Child private Base base StructTest include Child Child Child std cout Child std endl Child Child std cout Child std endl std cout Base std endl Base std cout std endl include Child int main Child child private StructTest Test 부모 클래스 멤버 자식 헤더 포인터 메인 오픈 특정 라이 러 함수 부모클래스 자식클래스 구조체 관리 소멸 상속 소멸자 자 * * "" :: :: :: :: :: << "" << :: ::~ :: << "" << :: :: -> :: * :: "" * * "" :: :: << "" << :: ::~ :: << "" << :: :: << :: << :: ; // :: :: << -> << :: ; // "" -> -> -> *",2
2011,"include include include void void int ch define define define LEFT define define int int nx ny int nstage char arstage int char int main int ch nstage arstage nstage sizeof arstage arstage nx ny ch getch ch ch ch getch ch ch ch ch nstage nstage break ch nstage nstage break ch exit void puts arstage gotoxy printf gotoxy printf gotoxy printf void int ch int dx dy switch ch case dx break case LEFT dx break case dy break case dy break arstage ny dy nx dx arstage ny dy nx dx arstage ny dy nx dx arstage ny dy nx dx arstage ny nx arstage ny dy nx dx arstage ny dy nx dx arstage ny dy nx dx arstage ny dy nx dx arstage ny dy nx dx arstage ny dy nx dx arstage ny nx nstage ny nx arstage ny nx arstage ny nx nx dx ny dy 소 코 좌표 각 복사 배열 총 횟수 하 혼자 함수 아이 조건문 다 // ;// ;// ;// # # @ # # # # @ # # # # # ], ; ; ++) ; ; ++) == == == == ' ') == ' ') == ' ') ; ; ; ; ++) % \ == ' ' == ' == ' * * ') * * == * * == ' ') * * ' ' == == ' ') @",1
2012,server server 공부중 서버 연결 포트 ,5
2013,def self None def aa print aa def self None def aa print aa br def self None def aa print aa 함수 클래스 선언 ,5
2014,  ,4
2015,"int int ar int px int max px ar px sizeof ar sizeof int px px px px max max px max int main int ar sum int px py scanf px ar px ar px py ar py py scanf py py ar sizeof ar sizeof int py sum py printf sum int sizeof ar sizeof int 포인터 디버깅 함수 * ; ++) (* * (* * ], * (""% & ; ; ++) ; *( (""% ; ; (""% )`",1
2016,"function function js function element alert type json create activity type group translate 제공 타입 납 함수 ' ': // ' ' "" ': ' ', ' ', ' ', // ('",4
2017,pass by reference Foo public Foo Foo new Foo Foo public void Foo Foo new Foo 메 메소드 소드 ,3
2018,"include stdio include string int main FILE fp char str fp fopen txt fp NULL printf while printf scanf str strcmp str end break strcmp str list fseek fp while fgets str sizeof str fp fp break printf str fprintf fp str fclose fp 원리 # * "" == .\ (""% ,"" "" "") == ), (""% ""% \",1
2019,pos pos height width int 직 판단 프로그램 모든 주실 ,2
2020,"in form submit submit disabled form HTML form text textarea textarea on change function var arr type textarea in arr console log arr value arr value button type submit disabled console log arr console log button type submit attr disabled disabled console log arr console log attr break text textarea attr disabled disabled console log type hidden value node test text value type text form control text node test textarea value textarea form control textarea node text value type text form control text node undefined attr object attr 현상 검사 버튼 변화 체크 문제점 '). (' ', $('. ], ]. ]. ="" (' (' ="" (' ', ' (' (' ', ' ') ="" "" "" // // // ="" "" ="" "" ="" ""> // // // ="" "" ="" ""> // // // ="" "" ="" ""> // //",4
2021,"client models await filename js js const async filename await fs join output filename err filename const async filename await work express filename utf public read write err socket emit js const app const require socket io app on connection socket socket on append async queue socket emit socket emit socket emit 통신 서버 클라이언트 업 업로드 로드 로컬 콜 콜백 분리 스트림 연결 이벤트 방향 => ), => => ' ' ' => // => (' (' ', => (' ', => //",4
2022,jsp css 웹 크롬 페이지 게시판 립스 한글 ,3
2023,print 프로세스 통신 가정 ,5
2024, 애플리케이션 메일 계정 ,3
2025,"jQuery var function slide previewImg console log previewImg on click function previewImg index this slide previewImg slide slide var console log 클릭 클릭시 함수 $ (' ', $",4
